{
  "schema_version": 2,
  "generated_at": "2026-07-17T11:27:57.143Z",
  "currency": "EUR",
  "products": [
    {
      "slug": "tshirt-climb",
      "name": "T-shirt CLIMB",
      "price": "29.99",
      "printful_sync_product_ids": [
        376170525,
        377330919
      ],
      "stripe_product_id": "prod_Uu1r9rybCSxQ99",
      "variants": [
        {
          "color": "Noir",
          "size": "S",
          "printful_color": "Black",
          "printful_size": "S",
          "printful_sync_product_id": 376170525,
          "printful_sync_variant_id": 4736126963,
          "printful_catalog_variant_id": 11546,
          "stripe_price_id": "price_1TuDoAImMzY0wzqJo0rO4uBH",
          "image_url": "https://files.cdn.printful.com/files/972/97276506fec22f1f552dd469b110dbc6_preview.png",
          "active": true
        },
        {
          "color": "Noir",
          "size": "M",
          "printful_color": "Black",
          "printful_size": "M",
          "printful_sync_product_id": 376170525,
          "printful_sync_variant_id": 4736126964,
          "printful_catalog_variant_id": 11547,
          "stripe_price_id": "price_1TuDoBImMzY0wzqJvHmeBfuX",
          "image_url": "https://files.cdn.printful.com/files/972/97276506fec22f1f552dd469b110dbc6_preview.png",
          "active": true
        },
        {
          "color": "Noir",
          "size": "L",
          "printful_color": "Black",
          "printful_size": "L",
          "printful_sync_product_id": 376170525,
          "printful_sync_variant_id": 4736126965,
          "printful_catalog_variant_id": 11548,
          "stripe_price_id": "price_1TuDoCImMzY0wzqJFGwhdJzv",
          "image_url": "https://files.cdn.printful.com/files/972/97276506fec22f1f552dd469b110dbc6_preview.png",
          "active": true
        },
        {
          "color": "Noir",
          "size": "XL",
          "printful_color": "Black",
          "printful_size": "XL",
          "printful_sync_product_id": 376170525,
          "printful_sync_variant_id": 4736126966,
          "printful_catalog_variant_id": 11549,
          "stripe_price_id": "price_1TuDoDImMzY0wzqJI2H6hTd8",
          "image_url": "https://files.cdn.printful.com/files/972/97276506fec22f1f552dd469b110dbc6_preview.png",
          "active": true
        },
        {
          "color": "Noir",
          "size": "2XL",
          "printful_color": "Black",
          "printful_size": "2XL",
          "printful_sync_product_id": 376170525,
          "printful_sync_variant_id": 4736126968,
          "printful_catalog_variant_id": 11550,
          "stripe_price_id": "price_1TuDoEImMzY0wzqJ4xyj4Go6",
          "image_url": "https://files.cdn.printful.com/files/972/97276506fec22f1f552dd469b110dbc6_preview.png",
          "active": true
        },
        {
          "color": "Blanc",
          "size": "S",
          "printful_color": "White",
          "printful_size": "S",
          "printful_sync_product_id": 377330919,
          "printful_sync_variant_id": 4748621312,
          "printful_catalog_variant_id": 11576,
          "stripe_price_id": "price_1TuDoFImMzY0wzqJ5XT7nXxX",
          "image_url": "https://files.cdn.printful.com/files/cea/cea2815271d823facc281126f8ac85ac_preview.png",
          "active": true
        },
        {
          "color": "Blanc",
          "size": "M",
          "printful_color": "White",
          "printful_size": "M",
          "printful_sync_product_id": 377330919,
          "printful_sync_variant_id": 4748621313,
          "printful_catalog_variant_id": 11577,
          "stripe_price_id": "price_1TuDoGImMzY0wzqJvO1lHWS7",
          "image_url": "https://files.cdn.printful.com/files/cea/cea2815271d823facc281126f8ac85ac_preview.png",
          "active": true
        },
        {
          "color": "Blanc",
          "size": "L",
          "printful_color": "White",
          "printful_size": "L",
          "printful_sync_product_id": 377330919,
          "printful_sync_variant_id": 4748621314,
          "printful_catalog_variant_id": 11578,
          "stripe_price_id": "price_1TuDoHImMzY0wzqJyyB3bU41",
          "image_url": "https://files.cdn.printful.com/files/cea/cea2815271d823facc281126f8ac85ac_preview.png",
          "active": true
        },
        {
          "color": "Blanc",
          "size": "XL",
          "printful_color": "White",
          "printful_size": "XL",
          "printful_sync_product_id": 377330919,
          "printful_sync_variant_id": 4748621315,
          "printful_catalog_variant_id": 11579,
          "stripe_price_id": "price_1TuDoIImMzY0wzqJCULPtntc",
          "image_url": "https://files.cdn.printful.com/files/cea/cea2815271d823facc281126f8ac85ac_preview.png",
          "active": true
        },
        {
          "color": "Blanc",
          "size": "2XL",
          "printful_color": "White",
          "printful_size": "2XL",
          "printful_sync_product_id": 377330919,
          "printful_sync_variant_id": 4748621316,
          "printful_catalog_variant_id": 11580,
          "stripe_price_id": "price_1TuDoJImMzY0wzqJxYeHBIK6",
          "image_url": "https://files.cdn.printful.com/files/cea/cea2815271d823facc281126f8ac85ac_preview.png",
          "active": true
        }
      ]
    },
    {
      "slug": "hoodie-vf-definition",
      "name": "Hoodie VF Definition",
      "price": "64.99",
      "printful_sync_product_ids": [
        376418591,
        377337480
      ],
      "stripe_product_id": "prod_Uu1sh351lCoCiz",
      "variants": [
        {
          "color": "Noir",
          "size": "S",
          "printful_color": "Black",
          "printful_size": "S",
          "printful_sync_product_id": 376418591,
          "printful_sync_variant_id": 4739108643,
          "printful_catalog_variant_id": 10779,
          "stripe_price_id": "price_1TuDoKImMzY0wzqJIPXjY1nW",
          "image_url": "https://files.cdn.printful.com/files/e28/e2841e982626fd73c5cca8cb7ffbf251_preview.png",
          "active": true
        },
        {
          "color": "Noir",
          "size": "M",
          "printful_color": "Black",
          "printful_size": "M",
          "printful_sync_product_id": 376418591,
          "printful_sync_variant_id": 4739108644,
          "printful_catalog_variant_id": 10780,
          "stripe_price_id": "price_1TuDoLImMzY0wzqJeNoLkLJe",
          "image_url": "https://files.cdn.printful.com/files/e28/e2841e982626fd73c5cca8cb7ffbf251_preview.png",
          "active": true
        },
        {
          "color": "Noir",
          "size": "L",
          "printful_color": "Black",
          "printful_size": "L",
          "printful_sync_product_id": 376418591,
          "printful_sync_variant_id": 4739108645,
          "printful_catalog_variant_id": 10781,
          "stripe_price_id": "price_1TuDoMImMzY0wzqJGJjDREyp",
          "image_url": "https://files.cdn.printful.com/files/e28/e2841e982626fd73c5cca8cb7ffbf251_preview.png",
          "active": true
        },
        {
          "color": "Noir",
          "size": "XL",
          "printful_color": "Black",
          "printful_size": "XL",
          "printful_sync_product_id": 376418591,
          "printful_sync_variant_id": 4739108646,
          "printful_catalog_variant_id": 10782,
          "stripe_price_id": "price_1TuDoNImMzY0wzqJvh4TOz1I",
          "image_url": "https://files.cdn.printful.com/files/e28/e2841e982626fd73c5cca8cb7ffbf251_preview.png",
          "active": true
        },
        {
          "color": "Noir",
          "size": "2XL",
          "printful_color": "Black",
          "printful_size": "2XL",
          "printful_sync_product_id": 376418591,
          "printful_sync_variant_id": 4739108647,
          "printful_catalog_variant_id": 10783,
          "stripe_price_id": "price_1TuDoNImMzY0wzqJC30cBYdk",
          "image_url": "https://files.cdn.printful.com/files/e28/e2841e982626fd73c5cca8cb7ffbf251_preview.png",
          "active": true
        },
        {
          "color": "Blanc",
          "size": "S",
          "printful_color": "White",
          "printful_size": "S",
          "printful_sync_product_id": 377337480,
          "printful_sync_variant_id": 4748673535,
          "printful_catalog_variant_id": 10774,
          "stripe_price_id": "price_1TuDoOImMzY0wzqJcawsoLIl",
          "image_url": "https://files.cdn.printful.com/files/15c/15c9ca5657bf08b547c6ed9c3b4331db_preview.png",
          "active": true
        },
        {
          "color": "Blanc",
          "size": "M",
          "printful_color": "White",
          "printful_size": "M",
          "printful_sync_product_id": 377337480,
          "printful_sync_variant_id": 4748673537,
          "printful_catalog_variant_id": 10775,
          "stripe_price_id": "price_1TuDoPImMzY0wzqJQ8OPsK0H",
          "image_url": "https://files.cdn.printful.com/files/15c/15c9ca5657bf08b547c6ed9c3b4331db_preview.png",
          "active": true
        },
        {
          "color": "Blanc",
          "size": "L",
          "printful_color": "White",
          "printful_size": "L",
          "printful_sync_product_id": 377337480,
          "printful_sync_variant_id": 4748673539,
          "printful_catalog_variant_id": 10776,
          "stripe_price_id": "price_1TuDoQImMzY0wzqJvOrIO4mv",
          "image_url": "https://files.cdn.printful.com/files/15c/15c9ca5657bf08b547c6ed9c3b4331db_preview.png",
          "active": true
        },
        {
          "color": "Blanc",
          "size": "XL",
          "printful_color": "White",
          "printful_size": "XL",
          "printful_sync_product_id": 377337480,
          "printful_sync_variant_id": 4748673542,
          "printful_catalog_variant_id": 10777,
          "stripe_price_id": "price_1TuDoRImMzY0wzqJGAYy43BO",
          "image_url": "https://files.cdn.printful.com/files/15c/15c9ca5657bf08b547c6ed9c3b4331db_preview.png",
          "active": true
        },
        {
          "color": "Blanc",
          "size": "2XL",